star,date,info,content
평점4,23.06.22.,용량: S23플러스 256GB / 색상: 그린,자급제 처음 구매라 걱정  됫는데 좋네요4%쿠폰 때문에 정신이 없던거 와 A34도 쌓여있던 종이포장이 비싼 S23플러스에 없는 게 살짝 당황하긴 했지만 기계에 이상 없이 사용하고 있는거에 만족합니다. 배송이 너무 빨라도 의심이....ㅎ충전기 헤드는 이틀 뒤에 따로 받았는데 폰 검수 다 하고 같이 보내주셔도 될듯요~(제 생각이 그래요)
평점5,23.06.20.,용량: S23플러스 512GB / 색상: 크림,자급제 처음이라 걱정 햇는데 고장없이 잘 사용 중  입니다. 주문한 다음날 저녁에 도착햇어요 배송 최고!!쿠폰에 문제가 있어 급하게 사느라 정신이 없엇긴 햇지만 약정 요금제 싫고 스마트스위치로 기존 폰에서 가져오는 것도 쉽고 저한테는 자급제가 딱이에요~S23플러스 2대 같이 사려다 아이디당 1대만 구매 가능해서 살짝 당황햇어요충전기는 다음날 따로 와서 받앗습니다.택배 비용 아까운듯ㅎ
평점5,23.09.12.,용량: S23플러스 256GB / 색상: 크림,갑자기 오래 쓰던 핸드폰이 고장나서 급하게 주문해 보았어요. 마침 쇼핑라이브랑 딱 맞아 떨어져서 잘 구매할 수 있었어요. 기본 포인트와 카드 썼을 때 주는 포인트 다 더하면 여기가 가장 싸서 정말 만족합니다.구입할 당시에 그린하고 블랙이 없어서 크림 샀는데 사신 그린이 사고 싶어서 그건 좀 아쉽고 바로 다음날 받을 수 있어서 진짜 좋았어요. 갤럭시23 플러스 아이폰보다 더 예쁘고 카메라도 좋고 정말 만족스러워요
평점5,23.06.14.,용량: S23플러스 256GB / 색상: 팬텀블랙,하루만에 배송되었습니다바로 배송이 되네요 주문하고 나서 컬러 교환요청드렸으나 결재하자 마자 배송준비가 되어서 교환을 못했네요아버지 생신선물이라 뜯어보진 못했습니다 뽁뽁이 없이 딸랑 택배박스에 담겨 와서 좀.....그렇긴 하지만 잘 왔겠지요 뭐
평점5,23.06.21.,용량: S23플러스 256GB / 색상: 크림,배송 정말 빠르게왔어요! 크림색상 품절이 많던데 여기에는 있어서 포인트까지 혜택보고 잘 구매했어어요~~ 폰디자인 맘에 들고 넘 좋네요! 충전기도 다음 날 잘 받았습니다
평점5,23.08.05.,용량: S23플러스 256GB / 색상: 라벤더,"S8 오래동안 쓰고, S23 으로 넘어오게 되었네요이게 바로 신세계네요. 배송 너무 너무 빠르떼, 상자가 찌그러져ㅠㅠ내용물은 포장이 잘되어 이상이 없네요S23 아 앞으로 잘 부탁한다 ㅎㅎ"
평점5,23.09.27.,용량: S23플러스 256GB / 색상: 라벤더,너무 이쁘네요 사길 잘한거 같아요아이폰14프로보다 살짝 크네요 그리고 살짝 더 가벼워요 잘쓸게요
평점5,23.06.15.,용량: S23플러스 256GB / 색상: 그린,핸드폰 바꿀때가 됐었는데 마침 라이브로 추가할인을 하고있어서 구매했어요. 어제 저녁에 주문하고 오늘 오후에 도착했어요. 심플한게 마음에 듭니다.
평점5,23.06.16.,용량: S23플러스 256GB / 색상: 라벤더,잘받았습니다. 아이폰에서 갈아타서 좀적응이 필요하지만 좋아요! 굿굿 색깔도 맘에들어요
평점4,23.08.17.,용량: S23플러스 256GB / 색상: 팬텀블랙,부모님한테 드리기 위해 구매했는데 봉인 테이프가 살짝 뜯어져 있긴 하지만 전체적으로 만족합니다.
평점5,23.08.24.,용량: S23플러스 256GB / 색상: 라벤더,담날배송되고 좋아요
평점5,23.07.03.,용량: S23플러스 256GB / 색상: 라벤더,배송도 완전 빠르고 제품 완전 저렴하게 잘 샀습니다
평점5,23.06.19.,용량: S23플러스 256GB / 색상: 라벤더,진짜 크림색이랑 겁나고민했는데 라벤더사길잘햇누👏👏겁나 만족이에요👍👍👍👍👍👍👍👍
평점5,23.06.17.,용량: S23플러스 256GB / 색상: 라벤더,색도 예쁘고 첫 자급젠데 만족합니다
평점5,23.06.27.,용량: S23플러스 256GB / 색상: 크림,바로 배송되서 너무 좋네요!크림색상 너무 예뻐요! 잘쓰겠습니다!
평점5,23.06.21.,용량: S23플러스 256GB / 색상: 크림,합리적인 가격에 너무 잘샀어요ㅎㅎ 색도 너무이쁘고 배송도 진짜 빠릅니다!! 오늘 보내주신 충전기까지 받았어요!!
평점5,23.10.06.,용량: S23플러스 512GB / 색상: 크림,자급제는 처음구입했는데배송도 빠르고 고등학생 조카 선물로 구입했는데용량.색상 더 만족하네요
평점5,23.06.20.,용량: S23플러스 256GB / 색상: 크림,정말 하루만에 배송왔네요너무 오랜만에 폰을 바꿔 정신은 없지만 최신폰 바꾸게 되어 기분 좋아요 싸게 사서 더 좋구요오래 쓰고 또 여기서 바꾸려구요친구에게도 소개할 생각이네요
평점4,23.09.16.,용량: S23플러스 256GB / 색상: 크림,주문하고 다음날 바로 받았어요.진짜 빠르네요. 크림색 너무 이뻐요
평점5,23.06.20.,용량: S23플러스 256GB / 색상: 크림,크림색 깔끔하고 예쁘네요!배터리는 듣던대로 깡패입니다.
평점5,23.09.18.,용량: S23플러스 256GB / 색상: 팬텀블랙,아이가 많이 좋아하네요잘 사용하겠습니다.감사합니다.
평점5,23.09.20.,용량: S23플러스 256GB / 색상: 크림,처음으로 자급제 구매했는데 좋네요ㅎㅎ마침 행사하고 있어서 저렴하게 구매했고원했던 크림색상이 있어서 얼른 겟 했습니다~배송도 빠름빠름 넘 맘에 듭니다👍
평점4,23.07.02.,용량: S23플러스 256GB / 색상: 그린,"빠르게 받아서 잘 사용하고 있습니다.톤 다운된 그린색이 독특하고 예뻐요.다만, 남편에게 선물했더니 투명 케이스 정도는 있을 줄 알았다며 아쉬워하네요.받자마자 케이스랑 액정 필름을 챙기느라 바빴네요."
평점5,23.06.24.,용량: S23플러스 256GB / 색상: 크림,갤럭시S20+ 쓰다가 액정이 깨져서 넘어왔습니다.우선 카메라가 엄청 좋고 사진 찍을 때 마다 렌즈를 안닦아도 돼서 편하네요. 핸드폰 자체는 S20+가 더 예쁘지만 기능이 좋으니까 만족합니다.
평점4,23.07.08.,용량: S23플러스 256GB / 색상: 크림,박스가;; 리뷰에 써잇던 그대로 상자를 그냥막 넣어서 보내셧더라구요박스는 다 찌그러지고; 그래도 잘되는거같아 다행이지요
평점5,23.07.02.,용량: S23플러스 512GB / 색상: 크림,자급제는 항상 라이브방송할때 사고있어요!!S22도 잘쓰고 있었는데 esim때문레 바꾸게 되었네요~ 배송 정말 빠르고 충전기도 있어서 좋았어요!
평점5,23.06.15.,용량: S23플러스 256GB / 색상: 크림,어제 라이브 방송보고 구매하고 하루만에 받았어요 크림색상 너무 이쁘고 크기도 커서 좋네요!
평점5,23.06.18.,용량: S23플러스 256GB / 색상: 라벤더,라이브 시작하자마자 주문했는데 다음날 바로 배송됐습니다! 노트8 쓰는데 버벅거려서 S23을 사려고 했는데 라이브 시작 1시간 전에 검색하다가 우연히 알게 돼서 싸게 잘 샀습니다. 30명 당첨도 되고 S23 행운이네요~
평점5,23.06.28.,용량: S23플러스 256GB / 색상: 크림,망설이다 라이브보고 구매했어요몇년만에 핸폰 바꿨더니 완전 신세계잘쓸께요^^
평점5,23.08.09.,용량: S23플러스 256GB / 색상: 팬텀블랙,배송도증말무지빠르고 자급제처음사봤는데 이상없고 선물받으신분도 무지 좋아하셨습니다! 감사해요
평점5,23.09.20.,용량: S23플러스 256GB / 색상: 크림,박스는 찌그러져있지만 상품은 멀쩡한것같네요색상 이쁘고 좋아요
평점5,23.06.16.,용량: S23플러스 256GB / 색상: 라벤더,배송도 빠르고 하자없는 새제품으로 받아서 기분이 좋네요.
평점5,23.06.17.,용량: S23플러스 256GB / 색상: 크림,전 날 밤에 시켰는데 다음날 11시에 도착했어요!엄청 빠르네요. 상태 좋고 너무 잘 쓰고 있어요~
평점5,23.06.23.,용량: S23플러스 256GB / 색상: 팬텀블랙,부모님이 너무 만족하시네요. 잘 산거 같습니다.
평점5,23.08.17.,용량: S23플러스 256GB / 색상: 크림,전 핸드폰 5년 넘게 사용하다가S23+가 너무 예뻐서 구매했어요전날 구매 했는데 다음날 왔고기기는 이제 막 사용중인데 외관은 깔끔했어요
평점5,23.08.19.,용량: S23플러스 256GB / 색상: 크림,초기 불량 및 교환중 배송 지연 하고는 있어지만 잘해결 해주어서 지금은 잘사용하고 있습니다.또 구매 필요시 주문 하겠습니다.
평점5,23.06.15.,용량: S23플러스 512GB / 색상: 크림,배송이 정말빠르고 가격이 좋네요
평점4,23.06.25.,용량: S23플러스 512GB / 색상: 크림,배송이 엄청 빨랐어요!!예쁘네요~!
평점5,23.08.18.,용량: S23플러스 512GB / 색상: 팬텀블랙,배송 잘 받았습니다.좋아요
평점4,23.09.22.,용량: S23플러스 256GB / 색상: 팬텀블랙,배송 매우 빨라서 좋았어요
평점5,23.09.10.,용량: S23플러스 256GB / 색상: 크림,배송도 빠르고 맘에들어요
평점5,23.08.21.,용량: S23플러스 256GB / 색상: 그린,항상 잘쓰고있습니다ㅎㅎ
평점5,23.06.22.,용량: S23플러스 512GB / 색상: 그린,빠른배송에 만족합니다.
평점5,23.06.18.,용량: S23플러스 512GB / 색상: 팬텀블랙,와우 잘구매 만족합니다
평점5,23.09.02.,용량: S23플러스 512GB / 색상: 크림,빨리 배송와서 좋아요
